title,link,karma,date,keep
Using Prompt Evaluation to Combat Bio-Weapon Research,https://www.alignmentforum.org/posts/sfucF8Mhcn7zmWQ8Y/using-prompt-evaluation-to-combat-bio-weapon-research,7,2025-02-19T12:39:00.491Z,
Misspecification in Inverse Reinforcement Learning - Part II,https://www.alignmentforum.org/posts/iKiREYhxLSjCkDGPa/misspecification-in-inverse-reinforcement-learning-part-ii,4,2025-02-28T19:24:59.570Z,
Amplifying the Computational No-Coincidence Conjecture,https://www.alignmentforum.org/posts/PxhCvDSfSqJYNXtaw/amplifying-the-computational-no-coincidence-conjecture,4,2025-03-07T21:29:54.933Z,
Emergent Misalignment and Emergent Alignment,https://www.alignmentforum.org/posts/aFtCG6JcG3ciaev9G/emergent-misalignment-and-emergent-alignment,2,2025-04-03T08:04:38.150Z,
"Training Data Attribution:
Examining Its Adoption & Use Cases",https://www.alignmentforum.org/posts/aHgvu6mz8gqQQqJwP/training-data-attribution-examining-its-adoption-and-use,1,2025-01-22T15:41:19.744Z,
Are SAE features from the Base Model still meaningful to LLaVA?,https://www.alignmentforum.org/posts/8JTi7N3nQmjoRRuMD/are-sae-features-from-the-base-model-still-meaningful-to-1,2,2025-02-18T22:16:14.449Z,
AXRP Episode 38.6 - Joel Lehman on Positive Visions of AI,https://www.alignmentforum.org/posts/5XC66LN3gS3w6mYnR/axrp-episode-38-6-joel-lehman-on-positive-visions-of-ai,7,2025-01-24T23:00:07.562Z,
How Language Models Understand Nullability,https://www.alignmentforum.org/posts/QqE7Gmcqjm5CX6zxE/how-language-models-understand-nullability,2,2025-03-11T15:57:28.686Z,
AXRP Episode 38.5 - Adrià Garriga-Alonso on Detecting AI Scheming,https://www.alignmentforum.org/posts/MpLmcLBiEbpzv2awg/axrp-episode-38-5-adria-garriga-alonso-on-detecting-ai,7,2025-01-20T00:40:07.077Z,
Sleeping Beauty: an Accuracy-based Approach,https://www.alignmentforum.org/posts/ECLEsydXxvtK3XxMs/sleeping-beauty-an-accuracy-based-approach,1,2025-02-10T15:40:29.619Z,
Cross-Layer Feature Alignment and Steering in Large Language Model,https://www.alignmentforum.org/posts/feknAa3hQgLG2ZAna/cross-layer-feature-alignment-and-steering-in-large-language-2,0,2025-02-08T20:18:20.331Z,y
SAE Training Dataset Influence in Feature Matching and a Hypothesis on Position Features,https://www.alignmentforum.org/posts/ATsvzF77ZsfWzyTak/dataset-sensitivity-in-feature-matching-and-a-hypothesis-on-1,0,2025-02-26T17:05:18.265Z,y
Forecasting AI Futures Resource Hub,https://www.alignmentforum.org/posts/jAPDX72dugrYrvFsd/forecasting-ai-futures-resource-hub,1,2025-03-19T17:26:28.059Z,
"Expanding HarmBench: Investigating Gaps & Extending Adversarial LLM Testing

",https://www.alignmentforum.org/posts/rh2Hzi7NLFdyxYogb/expanding-harmbench-investigating-gaps-and-extending,0,2025-03-03T19:23:20.687Z,y
Simplex Progress Report - July 2025,https://www.alignmentforum.org/posts/fhkurwqhjZopx8DKK/simplex-progress-report-july-2025,48,2025-07-28T21:58:56.847Z,y
Fifty Years Requests for Startups,https://www.alignmentforum.org/posts/7rYphMipLtiEXArPf/fifty-years-requests-for-startups,8,2025-09-15T18:37:56.488Z,
The Alignment Project by UK AISI,https://www.alignmentforum.org/posts/wKTwdgZDo479EhmJL/the-alignment-project-by-uk-aisi-1,13,2025-08-01T09:52:37.314Z,y
Open Philanthropy Technical AI Safety RFP - $40M Available Across 21 Research Areas,https://www.alignmentforum.org/posts/wbJxRNxuezvsGFEWv/open-philanthropy-technical-ai-safety-rfp-usd40m-available,54,2025-02-06T18:58:53.076Z,y
Announcing ILIAD2: ODYSSEY,https://www.alignmentforum.org/posts/WP7TbzzM39agMS77e/announcing-iliad2-odyssey-1,35,2025-04-03T17:01:06.004Z,y
AGI Safety & Alignment @ Google DeepMind is hiring,https://www.alignmentforum.org/posts/wqz5CRzqWkvzoatBG/agi-safety-and-alignment-google-deepmind-is-hiring,52,2025-02-17T21:11:18.970Z,y
Timaeus in 2024,https://www.alignmentforum.org/posts/gGAXSfQaiGBCwBJH5/timaeus-in-2024,38,2025-02-20T23:54:56.939Z,y
OpenAI now has an RL API which is broadly accessible,https://www.alignmentforum.org/posts/HevgiEWLMfzAAC6CD/openai-now-has-an-rl-api-which-is-broadly-accessible,21,2025-06-11T23:39:30.340Z,
Neel Nanda MATS Applications Open (Due Aug 29),https://www.alignmentforum.org/posts/cToqfmDuTX6CvkdKk/neel-nanda-mats-applications-open-due-aug-29,13,2025-07-30T00:55:20.101Z,
Alignment faking CTFs: Apply to my MATS stream,https://www.alignmentforum.org/posts/jWFvsJnJieXnWBb9r/alignment-faking-ctfs-apply-to-my-mats-stream,38,2025-04-04T16:29:02.070Z,y
Agent Foundations 2025 at CMU,https://www.alignmentforum.org/posts/cuf4oMFHEQNKMXRvr/agent-foundations-2025-at-cmu,42,2025-01-19T23:48:22.569Z,y
"Softmax, Emmett Shear's new AI startup focused on ""Organic Alignment""",https://www.alignmentforum.org/posts/QGQiCuE33iHFv9jkv/softmax-emmett-shear-s-new-ai-startup-focused-on-organic,24,2025-03-28T21:23:46.220Z,
Introducing BenchBench: An Industry Standard Benchmark for AI Strength,https://www.alignmentforum.org/posts/vyvsKNFS64WGZbBMb/introducing-benchbench-an-industry-standard-benchmark-for-ai-1,21,2025-04-02T02:11:41.555Z,y
Apply now to Human-Aligned AI Summer School 2025,https://www.alignmentforum.org/posts/JdrmKSzsWmRbgMumf/apply-now-to-human-aligned-ai-summer-school-2025,17,2025-06-06T19:31:40.085Z,
Timaeus is hiring researchers & engineers,https://www.alignmentforum.org/posts/g8e4pz7aHGCpahFR4/timaeus-is-hiring-researchers-and-engineers,27,2025-01-17T19:13:14.739Z,y
Announcement: Learning Theory Online Course,https://www.alignmentforum.org/posts/sPAA9X6basAXsWhau/announcement-learning-theory-online-course,26,2025-01-20T19:55:57.598Z,
The GDM AGI Safety+Alignment Team is Hiring for Applied Interpretability Research,https://www.alignmentforum.org/posts/aG9e5tHfHmBnDqrDy/the-gdm-agi-safety-alignment-team-is-hiring-for-applied,26,2025-02-24T02:17:12.991Z,y
AXRP Episode 43 - David Lindner on Myopic Optimization with Non-myopic Approval,https://www.alignmentforum.org/posts/jHxJ6y8fSx4mqweHp/axrp-episode-43-david-lindner-on-myopic-optimization-with,8,2025-06-15T01:20:02.873Z,
Schmidt Sciences Technical AI Safety RFP on Inference-Time Compute – Deadline: April 30,https://www.alignmentforum.org/posts/tTyQvHedrjFWjurGk/schmidt-sciences-technical-ai-safety-rfp-on-inference-time,10,2025-03-18T18:05:34.757Z,
What is the most impressive game LLMs can play well?Q,https://www.alignmentforum.org/posts/3c5tx5WjZ5Yvniq6Y/what-is-the-most-impressive-game-llms-can-play-well,9,2025-01-08T19:38:18.530Z,