title,link,karma,date,keep
"New, improved multiple-choice TruthfulQA",https://www.alignmentforum.org/posts/Bunfwz6JsNd44kgLT/new-improved-multiple-choice-truthfulqa,39,2025-01-15T23:32:09.202Z,
Handling schemers if shutdown is not an option,https://www.alignmentforum.org/posts/XxjScx4niRLWTfuD5/handling-schemers-if-shutdown-is-not-an-option,24,2025-04-18T14:39:18.609Z,
"Numberwang: LLMs Doing Autonomous Research, and a Call for Input",https://www.alignmentforum.org/posts/RSqfcyAW9ZkveGQ5u/numberwang-llms-doing-autonomous-research-and-a-call-for-1,28,2025-01-16T17:20:37.552Z,
"Inference-Time-Compute: More Faithful? 
A Research Note
",https://www.alignmentforum.org/posts/C8HAa2mf5kcBrpjkX/inference-time-compute-more-faithful-a-research-note,34,2025-01-15T04:43:00.631Z,y
Automated Researchers Can Subtly Sandbag,https://www.alignmentforum.org/posts/niBXcbthcQRXG5M5Y/automated-researchers-can-subtly-sandbag,23,2025-03-26T19:13:26.879Z,
Doing good... best?,https://www.alignmentforum.org/posts/3EqToCdzMXcmKd2ct/doing-good-best,0,2025-08-22T15:48:41.820Z,
Modeling versus Implementation,https://www.alignmentforum.org/posts/rysmFDWKT5L7uNTqD/modeling-versus-implementation,13,2025-05-18T13:38:20.421Z,
Layered AI Defenses Have Holes: Vulnerabilities and Key Recommendations,https://www.alignmentforum.org/posts/Z8tAn3jp2uaQf34Mm/layered-ai-defenses-have-holes-vulnerabilities-and-key,6,2025-07-04T00:07:17.845Z,
An Easily Overlooked Post on the Automation of Wisdom and Philosophy,https://www.alignmentforum.org/posts/WBMcKgrTpmniTK8HG/an-easily-overlooked-post-on-the-automation-of-wisdom-and,8,2025-06-12T02:54:50.303Z,
"For scheming, we should first focus on detection and then on prevention",https://www.alignmentforum.org/posts/bAWPsgbmtLf8ptay6/for-scheming-we-should-first-focus-on-detection-and-then-on,25,2025-03-04T15:22:06.105Z,
Research Areas in Economic Theory and Game Theory (The Alignment Project by UK AISI),https://www.alignmentforum.org/posts/o3rvXNLJTNh44oTy3/research-areas-in-economic-theory-and-game-theory-the,3,2025-08-01T10:25:58.917Z,
The Self-Hating Attention Head: A Deep Dive in GPT-2,https://www.alignmentforum.org/posts/wxPvdBwWeaneAsWRB/the-self-hating-attention-head-a-deep-dive-in-gpt-2-1,1,2025-07-04T13:07:44.841Z,
Gaming TruthfulQA: Simple Heuristics Exposed Dataset Weaknesses,https://www.alignmentforum.org/posts/57k6xNcWtAtsSTcor/gaming-truthfulqa-simple-heuristics-exposed-dataset,31,2025-01-16T02:14:35.098Z,
We Have No Plan for Preventing Loss of Control in Open Models,https://www.alignmentforum.org/posts/QSyshep2CRs8JTPwK/we-have-no-plan-for-preventing-loss-of-control-in-open,12,2025-03-10T15:35:12.597Z,
Agentic Interpretability: A Strategy Against Gradual Disempowerment,https://www.alignmentforum.org/posts/s9z4mgjtWTPpDLxFy/agentic-interpretability-a-strategy-against-gradual,7,2025-06-17T14:52:55.695Z,y
"Dream, Truth, & Good",https://www.alignmentforum.org/posts/DPjvL62kskHpp2SZg/dream-truth-and-good,23,2025-02-24T16:59:05.045Z,
Recommendations for Technical AI Safety Research Directions,https://www.alignmentforum.org/posts/tG9LGHLzQezH3pvMs/recommendations-for-technical-ai-safety-research-directions,34,2025-01-10T19:34:04.920Z,y
Recent progress on the science of evaluations,https://www.alignmentforum.org/posts/m2qMj7ovncbqKtzNt/recent-progress-on-the-science-of-evaluations,7,2025-06-23T09:41:44.185Z,
A sketch of an AI control safety case,https://www.alignmentforum.org/posts/vWYzSorAEWwoJnnXq/a-sketch-of-an-ai-control-safety-case,33,2025-01-30T17:28:47.992Z,
An overview of control measures,https://www.alignmentforum.org/posts/G8WwLmcGFa4H6Ld9d/an-overview-of-control-measures,29,2025-03-24T23:16:49.400Z,y
Forecasting time to automated superhuman coders [AI 2027 Timelines Forecast],https://www.alignmentforum.org/posts/ggqSg7bSLChanfunf/forecasting-time-to-automated-superhuman-coders-ai-2027,13,2025-04-10T23:10:23.063Z,y
The ultimate goal,https://www.alignmentforum.org/posts/PCxevdhZtesKurYHD/the-ultimate-goal,3,2025-07-05T19:10:51.243Z,
AXRP Episode 44 - Peter Salib on AI Rights for Human Safety,https://www.alignmentforum.org/posts/vHDowQtsiy2xK38H4/axrp-episode-44-peter-salib-on-ai-rights-for-human-safety,6,2025-06-28T01:40:04.658Z,
"With enough knowledge, any conscious agent acts morally",https://www.alignmentforum.org/posts/EbRLty44fFtoWduj4/with-enough-knowledge-any-conscious-agent-acts-morally,0,2025-08-22T15:44:07.587Z,
Selection Pressures on LM Personas,https://www.alignmentforum.org/posts/LdBhgAhpvbdEep79F/selection-pressures-on-lm-personas,17,2025-03-28T20:33:09.918Z,
Three Types of Intelligence Explosion,https://www.alignmentforum.org/posts/PzbEpSGvwH3NnegDB/three-types-of-intelligence-explosion,16,2025-03-17T14:47:46.696Z,
My Research Process: Understanding and Cultivating Research Taste,https://www.alignmentforum.org/posts/Ldrss6o3tiKT6NdMm/my-research-process-understanding-and-cultivating-research,13,2025-05-01T23:08:42.212Z,
Paths and waystations in AI safety,https://www.alignmentforum.org/posts/kBgySGcASWa4FWdD9/paths-and-waystations-in-ai-safety-1,22,2025-03-11T18:52:57.772Z,
SHIFT relies on token-level features to de-bias Bias in Bios probes,https://www.alignmentforum.org/posts/QdxwGz9AeDu5du4Rk/shift-relies-on-token-level-features-to-de-bias-bias-in-bios,21,2025-03-19T21:29:15.974Z,
Research Areas in Probabilistic Methods (The Alignment Project by UK AISI),https://www.alignmentforum.org/posts/Mv5qE29RvWcau2pGA/research-areas-in-probabilistic-methods-the-alignment,3,2025-08-01T10:26:07.666Z,
Why do misalignment risks increase as AIs get more capable?,https://www.alignmentforum.org/posts/NDotm7oLHfR56g4sD/why-do-misalignment-risks-increase-as-ais-get-more-capable,18,2025-04-11T03:06:50.928Z,
Non-Monotonic Infra-Bayesian Physicalism,https://www.alignmentforum.org/posts/DobZ62XMdiPigii9H/non-monotonic-infra-bayesian-physicalism,13,2025-04-02T12:14:19.783Z,
Video & transcript: Challenges for Safe & Beneficial Brain-Like AGI,https://www.alignmentforum.org/posts/YKmyay3bWF2ofAGNo/video-and-transcript-challenges-for-safe-and-beneficial,14,2025-05-08T21:11:49.901Z,
Testing for Scheming with Model Deletion,https://www.alignmentforum.org/posts/D5kGGGhsnfH7G8v9f/testing-for-scheming-with-model-deletion,26,2025-01-07T01:54:13.550Z,
MONA: Three Month Later - Updates and Steganography Without Optimization Pressure,https://www.alignmentforum.org/posts/zF5gXf3KJhmvojDRf/mona-three-month-later-updates-and-steganography-without,17,2025-04-12T23:15:07.964Z,y
"Superintelligent Agents Pose Catastrophic Risks:
Can Scientist AI Offer a Safer Path?",https://www.alignmentforum.org/posts/p5gBcoQeBsvsMShvT/superintelligent-agents-pose-catastrophic-risks-can,13,2025-02-24T18:31:48.580Z,y
Absolute Zero: Alpha Zero for LLM,https://www.alignmentforum.org/posts/dkWicxcPKdSx9npK4/absolute-zero-alpha-zero-for-llm,10,2025-05-11T20:42:51.937Z,
Subversion Strategy Eval: Can language models statelessly strategize to subvert control protocols?,https://www.alignmentforum.org/posts/RxRKGwBkCX3YsthfK/subversion-strategy-eval-can-language-models-statelessly,24,2025-03-24T17:55:59.358Z,
What is the functional role of SAE errors?,https://www.alignmentforum.org/posts/WzHPpMz2kRongsA7q/what-is-the-functional-role-of-sae-errors,5,2025-06-20T18:11:45.373Z,
An Introduction to Reinforcement Learning for Understanding Infra-Bayesianism,https://www.alignmentforum.org/posts/gd4ALPL9nSyTgzccz/an-introduction-to-reinforcement-learning-for-understanding,10,2025-05-17T02:34:50.413Z,y
How to evaluate control measures for LLM agents? A trajectory from today to superintelligence,https://www.alignmentforum.org/posts/2XYcK9WHACzxfHJju/how-to-evaluate-control-measures-for-llm-agents-a-trajectory,18,2025-04-14T16:45:46.584Z,
One more reason for AI capable of independent moral reasoning: alignment itself and cause prioritisation,https://www.alignmentforum.org/posts/tYCinFKtbBEg42gy9/one-more-reason-for-ai-capable-of-independent-moral,1,2025-08-22T15:53:36.568Z,
Validating against a misalignment detector is very different to training against one,https://www.alignmentforum.org/posts/CXYf7kGBecZMajrXC/validating-against-a-misalignment-detector-is-very-different,23,2025-03-04T15:41:04.692Z,
Self-dialogue: Do behaviorist rewards make scheming AGIs?,https://www.alignmentforum.org/posts/SFgLBQsLB3rprdxsq/self-dialogue-do-behaviorist-rewards-make-scheming-agis,22,2025-02-13T18:39:37.770Z,y
An overview of areas of control work,https://www.alignmentforum.org/posts/Eeo9NrXeotWuHCgQW/an-overview-of-areas-of-control-work,22,2025-03-25T22:02:16.178Z,
Subjective Naturalism in Decision Theory: Savage vs. Jeffrey–Bolker,https://www.alignmentforum.org/posts/FL8RunWvyS5L8uJEw/subjective-naturalism-in-decision-theory-savage-vs-jeffrey,14,2025-02-04T20:34:22.625Z,
Reasoning models don't always say what they think,https://www.alignmentforum.org/posts/PrcBFPkoRNGWrvdPk/reasoning-models-don-t-always-say-what-they-think-1,12,2025-04-09T19:48:58.733Z,
"Prospects for Alignment Automation:
Interpretability Case Study",https://www.alignmentforum.org/posts/y5cYisQ2QHiSbQbhk/prospects-for-alignment-automation-interpretability-case,14,2025-03-21T14:05:51.528Z,
Sufficiently Decentralized Intelligence is Indistinguishable from Synchronicity,https://www.alignmentforum.org/posts/SePsaQzDbGGTMzaJZ/sufficiently-decentralized-intelligence-is-indistinguishable,17,2025-03-07T21:50:32.231Z,
"Policy Entropy, Learning, and Alignment (Or Maybe Your LLM Needs Therapy)",https://www.alignmentforum.org/posts/C4tvfHn2DfxyYYwaL/policy-entropy-learning-and-alignment-or-maybe-your-llm,7,2025-05-31T22:09:51.411Z,
Role embeddings: making authorship more salient to LLMs,https://www.alignmentforum.org/posts/HEzNZ9gvgYwT3aZFS/role-embeddings-making-authorship-more-salient-to-llms,25,2025-01-07T20:13:16.677Z,
Introducing MASK: A Benchmark for Measuring Honesty in AI Systems,https://www.alignmentforum.org/posts/TgDymNrGRoxPv4SWj/the-mask-benchmark-disentangling-honesty-from-accuracy-in-ai-3,17,2025-03-05T22:56:46.155Z,
In response to critiques of Guaranteed Safe AI,https://www.alignmentforum.org/posts/DZuBHHKao6jsDDreH/in-response-to-critiques-of-guaranteed-safe-ai,19,2025-01-31T01:43:05.787Z,
Corrupted by Reasoning: Reasoning Language Models Become Free-Riders in Public Goods Games,https://www.alignmentforum.org/posts/M6dXdCbdoLSpHt8v3/corrupted-by-reasoning-reasoning-language-models-become-free,13,2025-04-22T19:25:35.302Z,
Proof idea: SLT to AIT,https://www.alignmentforum.org/posts/3ZBmKDpAJJahRM248/proof-idea-slt-to-ait,17,2025-02-10T23:14:24.538Z,y
AXRP Episode 42 - Owain Evans on LLM Psychology,https://www.alignmentforum.org/posts/ZiacrsqoWHczctTBS/axrp-episode-42-owain-evans-on-llm-psychology,7,2025-06-06T20:20:03.549Z,
Video and transcript of talk on automating alignment research,https://www.alignmentforum.org/posts/TQbptN7F4ijPnQRLy/video-and-transcript-of-talk-on-automating-alignment,11,2025-04-30T17:43:06.557Z,
Renormalization Redux: QFT Techniques for AI Interpretability,https://www.alignmentforum.org/posts/sjr66DBEgyogAbfdf/renormalization-redux-qft-techniques-for-ai-interpretability,18,2025-01-18T03:54:28.652Z,
How to mitigate sandbagging,https://www.alignmentforum.org/posts/Qv5PkrJYAaiBuEJjB/how-to-mitigate-sandbagging-1,12,2025-03-23T17:19:07.452Z,
Why modelling multi-objective homeostasis is essential for AI alignment (and how it helps with AI safety as well). Subtleties and Open Challenges.,https://www.alignmentforum.org/posts/vGeuBKQ7nzPnn5f7A/why-modelling-multi-objective-homeostasis-is-essential-for,12,2025-01-12T03:37:59.692Z,
Why care about AI personhood?,https://www.alignmentforum.org/posts/Gh4fyTxGCpWS4jT82/why-care-about-ai-personhood,20,2025-01-26T11:24:45.596Z,
EIS XV: A New Proof of Concept for Useful Interpretability,https://www.alignmentforum.org/posts/HYkg6kwqhCQT5uYuK/eis-xv-a-new-proof-of-concept-for-useful-interpretability,20,2025-03-17T20:05:30.580Z,
Forecasting AI Forecasting,https://www.alignmentforum.org/posts/LczkzW4uPaQS3joj8/forecasting-ai-forecasting,2,2025-06-23T13:39:41.097Z,
Potentially Useful Projects in Wise AI,https://www.alignmentforum.org/posts/24RvfBgyt72XzfEYS/potentially-useful-projects-in-wise-ai,4,2025-06-05T08:13:42.839Z,
The Internal Model Principle: A Straightforward Explanation,https://www.alignmentforum.org/posts/fsQzYmuFN65vHcEcH/the-internal-model-principle-a-straightforward-explanation,6,2025-04-12T10:58:51.479Z,
Estimating the Probability of Sampling a Trained Neural Network at Random,https://www.alignmentforum.org/posts/ubhqr7n57S4nwgc56/estimating-the-probability-of-sampling-a-trained-neural,17,2025-03-01T02:11:56.313Z,
"Extended analogy between humans, corporations, and AIs.",https://www.alignmentforum.org/posts/bsTzgG3cRrsgbGtCc/extended-analogy-between-humans-corporations-and-ais,17,2025-02-13T00:03:13.956Z,
AXRP Episode 40 - Jason Gross on Compact Proofs and Interpretability,https://www.alignmentforum.org/posts/TFToqpaKMhcjAEY5E/axrp-episode-40-jason-gross-on-compact-proofs-and,13,2025-03-28T18:40:01.856Z,
"Illusory Safety: Redteaming DeepSeek R1 and the Strongest Fine-Tunable Models of OpenAI, Anthropic, and Google",https://www.alignmentforum.org/posts/zjqrSKZuRLnjAniyo/illusory-safety-redteaming-deepseek-r1-and-the-strongest,16,2025-02-07T03:57:30.904Z,
Takeaways From Our Recent Work on SAE Probing,https://www.alignmentforum.org/posts/osNKnwiJWHxDYvQTD/takeaways-from-our-recent-work-on-sae-probing,12,2025-03-03T19:50:16.692Z,
Is alignment reducible to becoming more coherent?,https://www.alignmentforum.org/posts/nuDJNyG5XLQjtvaeg/is-alignment-reducible-to-becoming-more-coherent,9,2025-04-22T23:47:34.531Z,
Existing UDTs test the limits of Bayesianism (and consistency),https://www.alignmentforum.org/posts/w2QmWzZBTBJ76xuwH/existing-udts-test-the-limits-of-bayesianism-and-consistency,7,2025-03-12T04:09:11.615Z,
Abstract Mathematical Concepts vs. Abstractions Over Real-World Systems,https://www.alignmentforum.org/posts/T6xSXiXF3WF6TmCyN/abstract-mathematical-concepts-vs-abstractions-over-real,19,2025-02-18T18:04:46.717Z,
Deep sparse autoencoders yield interpretable features too,https://www.alignmentforum.org/posts/tLCBJn3NcSNzi5xng/deep-sparse-autoencoders-yield-interpretable-features-too,13,2025-02-23T05:46:59.189Z,
SimpleStories: A Better Synthetic Dataset and Tiny Models for Interpretability,https://www.alignmentforum.org/posts/mjzj3pfXrjspAPkbM/simplestories-a-better-synthetic-dataset-and-tiny-models-for,3,2025-05-03T14:04:08.871Z,
Eliciting bad contexts,https://www.alignmentforum.org/posts/inkzPmpTFBdXoKLqC/eliciting-bad-contexts,21,2025-01-24T10:39:39.358Z,
Notes on handling non-concentrated failures with AI control: high level methods and different regimes,https://www.alignmentforum.org/posts/D5H5vcnhBz8G4dh6v/notes-on-handling-non-concentrated-failures-with-ai-control,16,2025-03-24T01:00:38.222Z,
Building Big Science from the Bottom-Up: A Fractal Approach to AI Safety,https://www.alignmentforum.org/posts/5JJ4AxQRzJGWdj4pN/building-big-science-from-the-bottom-up-a-fractal-approach,16,2025-01-07T03:08:51.447Z,
"Why Aligning an LLM is Hard, and How to Make it Easier",https://www.alignmentforum.org/posts/XdpJsY6QGdCbvo2dS/why-aligning-an-llm-is-hard-and-how-to-make-it-easier,11,2025-01-23T06:44:04.048Z,
AI Safety & Entrepreneurship v1.0,https://www.alignmentforum.org/posts/WbBe7LKNwv7fBgqii/ai-safety-and-entrepreneurship-v1-0,7,2025-04-26T14:37:11.037Z,
What if Agent-4 breaks out?,https://www.alignmentforum.org/posts/3GawHDBhsgg3CGbNb/what-if-agent-4-breaks-out,3,2025-05-15T09:15:17.340Z,
The Theoretical Reward Learning Research Agenda: Introduction and Motivation,https://www.alignmentforum.org/posts/pJ3mDD7LfEwp3s5vG/the-theoretical-reward-learning-research-agenda-introduction,15,2025-02-28T19:20:30.168Z,
"S-Expressions as a Design Language: A Tool for Deconfusion in Alignment
",https://www.alignmentforum.org/posts/aeBAkCPqWHscrAZKA/s-expressions-as-a-design-language-a-tool-for-deconfusion-in,5,2025-06-19T19:03:13.418Z,
"Grammars, subgrammars, and combinatorics of generalization in transformers",https://www.alignmentforum.org/posts/sjoW35fgBJ82ADuND/grammars-subgrammars-and-combinatorics-of-generalization-in,18,2025-01-02T09:37:23.191Z,
Investigating Accidental Misalignment: Causal Effects of Fine-Tuning Data on Model Vulnerability,https://www.alignmentforum.org/posts/zmSafQK7JjmfydAtT/investigating-accidental-misalignment-causal-effects-of-fine,1,2025-06-11T19:30:17.553Z,
"Alignment first, intelligence later",https://www.alignmentforum.org/posts/sDuWXb8cPXZ2yHdH4/alignment-first-intelligence-later,0,2025-03-30T22:26:55.302Z,
"Sleep peacefully: no hidden reasoning detected in LLMs. Well, at least in small ones. ",https://www.alignmentforum.org/posts/6GgHMBsAjD74KZAsB/sleep-peacefully-no-hidden-reasoning-detected-in-llms-well,9,2025-04-04T20:49:59.031Z,
"Don't you mean ""the most *conditionally* forbidden technique?""",https://www.alignmentforum.org/posts/jokdGg3wciyoeZTN2/don-t-you-mean-the-most-conditionally-forbidden-technique-1,6,2025-04-26T03:45:38.026Z,
Takeaways from sketching a control safety case,https://www.alignmentforum.org/posts/y6rBarAPTLmuhn9PJ/takeaways-from-sketching-a-control-safety-case,21,2025-01-31T04:43:45.917Z,
Will AI R&D Automation Cause a Software Intelligence Explosion?,https://www.alignmentforum.org/posts/tMHPQ5SDzm8gugoBN/will-ai-r-and-d-automation-cause-a-software-intelligence-1,10,2025-03-26T18:12:02.524Z,
[Replication] Crosscoder-based Stage-Wise Model Diffing,https://www.alignmentforum.org/posts/hxxramAB82tjtpiQu/replication-crosscoder-based-stage-wise-model-diffing-2,7,2025-03-22T18:35:19.003Z,
Early Experiments in Human Auditing for AI Control,https://www.alignmentforum.org/posts/2CJyfgaJQk8pyRSCp/auditing-1,16,2025-01-23T01:34:31.682Z,
Extending control evaluations to non-scheming threats,https://www.alignmentforum.org/posts/ArK2YhmpTy8XftubN/extending-control-evaluations-to-non-scheming-threats,15,2025-01-12T01:42:54.614Z,
When should we worry about AI power-seeking?,https://www.alignmentforum.org/posts/QyaJQ82FSsKXrvj7t/when-should-we-worry-about-ai-power-seeking,13,2025-02-19T19:44:25.062Z,
Outer Alignment is the Necessary Compliment to AI 2027's Best Case Scenario,https://www.alignmentforum.org/posts/rpKPgzjr3tPkDZChg/outer-alignment-is-the-necessary-compliment-to-ai-2027-s,2,2025-06-09T15:43:40.505Z,
When does capability elicitation bound risk?,https://www.alignmentforum.org/posts/u3taQsgxqCzrgErMM/when-does-capability-elicitation-bound-risk,18,2025-01-22T03:42:36.289Z,
Literature Review of Text AutoEncoders,https://www.alignmentforum.org/posts/PjEtMQ65sux4mgrCT/literature-review-of-text-autoencoders-1,4,2025-02-19T21:54:14.905Z,
Misspecification in Inverse Reinforcement Learning,https://www.alignmentforum.org/posts/orCtTgQkWwwD3XN87/misspecification-in-inverse-reinforcement-learning,10,2025-02-28T19:24:49.204Z,
Open Challenges in Representation Engineering,https://www.alignmentforum.org/posts/4nfDXmacAFgdhPwo3/open-challenges-in-representation-engineering-2,8,2025-04-03T19:21:45.971Z,y
Rebuttals for ~all criticisms of AIXI,https://www.alignmentforum.org/posts/TXmXrnFqLqKDx882e/rebuttals-for-all-criticisms-of-aixi,13,2025-01-07T17:41:10.557Z,
Can LLM-based models do model-based planning?,https://www.alignmentforum.org/posts/d2pohPvyve5sbTsTZ/can-llm-based-models-do-model-based-planning-1,5,2025-04-16T12:38:00.793Z,
Revising Stages-Oversight Reveals Greater Situational Awareness in LLMs,https://www.alignmentforum.org/posts/5naJwQnbb5bwPCCFz/revising-stages-oversight,4,2025-03-12T17:56:31.910Z,
Measuring Beliefs of Language Models During Chain-of-Thought Reasoning,https://www.alignmentforum.org/posts/a86uAnPykqNtmEbDH/measuring-beliefs-of-language-models-during-chain-of-thought-1,5,2025-04-18T22:56:28.727Z,
Is weak-to-strong generalization an alignment technique?Q,https://www.alignmentforum.org/posts/NPBjELgHFEeHTgDrK/is-weak-to-strong-generalization-an-alignment-technique,14,2025-01-31T07:13:03.332Z,
AI threatens to orchestrate sustainable social reform,https://www.alignmentforum.org/posts/MSt4ZmFE7nD9CetMT/ai-threatens-to-orchestrate-sustainable-social-reform,7,2025-04-02T03:04:43.182Z,
Is AI Physical?,https://www.alignmentforum.org/posts/yiqcFdAq8nqfMPGmS/is-ai-physical,9,2025-01-14T21:21:39.999Z,
Are we trying to figure out if AI is conscious?,https://www.alignmentforum.org/posts/TqBTdiWzAhA7qa5ke/are-we-trying-to-figure-out-if-ai-is-conscious-1,6,2025-01-27T01:05:07.001Z,
An idea for avoiding neuralese architectures,https://www.alignmentforum.org/posts/3W8HZe8mcyoo4qGkB/an-idea-for-avoiding-neuralese-architectures-1,2,2025-04-03T22:23:21.653Z,
How to Contribute to Theoretical Reward Learning Research,https://www.alignmentforum.org/posts/ByG7g3eSYhzduqg6s/how-to-contribute-to-theoretical-reward-learning-research,10,2025-02-28T19:27:52.552Z,
Other Papers About the Theory of Reward Learning,https://www.alignmentforum.org/posts/chbFoBYzkap2y46QD/other-papers-about-the-theory-of-reward-learning,10,2025-02-28T19:26:11.490Z,
Partial Identifiability in Reward Learning,https://www.alignmentforum.org/posts/nk4ifEfJYG7J38qwv/partial-identifiability-in-reward-learning,9,2025-02-28T19:23:30.738Z,
Measuring Schelling Coordination - Reflections on Subversion Strategy Eval,https://www.alignmentforum.org/posts/vsAxLSShMgy5Qjub5/measuring-schelling-coordination-reflections-on-subversion,4,2025-05-12T19:06:00.449Z,
Defining and Characterising Reward Hacking,https://www.alignmentforum.org/posts/vnNdpaXehmefXSe2H/defining-and-characterising-reward-hacking,9,2025-02-28T19:25:42.777Z,
When is it Better to Train on the Alignment Proxy?,https://www.alignmentforum.org/posts/zLvt2xHopdbArfvbM/when-is-it-better-to-train-on-the-alignment-proxy,9,2025-03-11T13:35:51.152Z,
Powerful Predictions,https://www.alignmentforum.org/posts/LT73KyjG9aFxuvvoT/powerful-predictions,2,2025-06-05T10:44:33.457Z,
What makes a theory of intelligence useful?,https://www.alignmentforum.org/posts/3donrE5vFHeMJFLY9/what-makes-a-theory-of-intelligence-useful,4,2025-02-20T19:22:29.725Z,
Won't vs. Can't: Sandbagging-like Behavior from Claude Models,https://www.alignmentforum.org/posts/oJHgwBCJ2tnrCpZun/won-t-vs-can-t-sandbagging-like-behavior-from-claude-models-2,6,2025-02-19T20:47:06.792Z,
Will the Need to Retrain AI Models from Scratch Block a Software Intelligence Explosion?,https://www.alignmentforum.org/posts/5CgxLpD2Fi9FkDFD4/will-the-need-to-retrain-ai-models-from-scratch-block-a-1,6,2025-03-28T14:12:02.163Z,
TAMing The Alignment Problem,https://www.alignmentforum.org/posts/MoW6wNKdaB4DbqzGr/taming-the-alignment-problem,2,2025-04-07T08:47:22.080Z,
Half-baked idea: a straightforward method for learning environmental goals?,https://www.alignmentforum.org/posts/hzXFthtujYhDXMgFd/tbd-3,4,2025-02-04T06:56:31.813Z,
"Linkpost to a Summary of ""Imagining and building wise machines: The centrality of AI metacognition"" by Johnson, Karimi, Bengio, et al.",https://www.alignmentforum.org/posts/axKyBatdWtce48Zda/linkpost-to-a-summary-of-imagining-and-building-wise,4,2025-04-10T11:54:37.484Z,
Defense Against the Dark Prompts: Mitigating Best-of-N Jailbreaking with Prompt Evaluation,https://www.alignmentforum.org/posts/5MyB8k8hSJRfa3udi/defense-against-the-dark-prompts-mitigating-best-of-n,11,2025-01-31T15:36:01.050Z,
Commitment Races are a technical problem ASI can easily solve,https://www.alignmentforum.org/posts/ReFEceKCnCsqHLkTY/commitment-races-are-a-technical-problem-asi-can-easily-1,3,2025-04-12T22:22:47.790Z,
Measuring Nonlinear Feature Interactions in Sparse Crosscoders [Project Proposal],https://www.alignmentforum.org/posts/RjrGAqJbk849Q7PHP/measuring-nonlinear-feature-interactions-in-sparse,8,2025-01-06T04:22:12.633Z,
Proof Section to an Introduction to Reinforcement Learning for Understanding Infra-Bayesianism,https://www.alignmentforum.org/posts/KRPWJiCfcmdB5smdb/proof-section-to-an-introduction-to-reinforcement-learning,2,2025-05-17T02:36:22.105Z,
[Research sprint] Single-model crosscoder feature ablation and steering,https://www.alignmentforum.org/posts/TEx9J7r5YsRfMuhpX/research-sprint-single-model-crosscoder-feature-ablation-and,3,2025-04-06T14:42:30.357Z,
Mind the Coherence Gap: Lessons from Steering Llama with Goodfire,https://www.alignmentforum.org/posts/6dpKhtniqR3rnstnL/mind-the-coherence-gap-lessons-from-steering-llama-with-1,2,2025-05-09T21:29:35.232Z,
Tied Crosscoders: Explaining Chat Behavior from Base Model,https://www.alignmentforum.org/posts/3T8eKyaPvDDm2wzor/research-question,4,2025-03-22T18:07:21.751Z,
Levels of analysis for thinking about agency,https://www.alignmentforum.org/posts/9w62Pjz5enFkzHW59/levels-of-analysis-for-thinking-about-agency,4,2025-02-26T04:24:24.583Z,
Forecasting AGI: Insights from Prediction Markets and Metaculus,https://www.alignmentforum.org/posts/dRbvHfEwb6Cuf6xn3/forecasting-agi-insights-from-prediction-markets-and-1,4,2025-02-04T13:03:45.927Z,
STARC: A General Framework For Quantifying Differences Between Reward Functions,https://www.alignmentforum.org/posts/EH5YPCAoy6urmz5sF/starc-a-general-framework-for-quantifying-differences,6,2025-02-28T19:24:52.965Z,
Musings on Scenario Forecasting and AI,https://www.alignmentforum.org/posts/ZK3SCtu2gz9vq9ffn/musings-on-scenario-forecasting-and-ai,2,2025-03-06T12:28:19.662Z,
Transformer Dynamics: a neuro-inspired approach to MechInterp,https://www.alignmentforum.org/posts/vucxxwdJARR3cqaPc/transformer-dynamics-a-neuro-inspired-approach-to-mechinterp,4,2025-02-22T21:33:23.855Z,
The Elicitation Game: Evaluating capability elicitation techniques,https://www.alignmentforum.org/posts/6QA5eHBEqpAicCwbh/the-elicitation-game-evaluating-capability-elicitation,4,2025-02-27T20:33:24.861Z,
